{
  "map": "2004-2024",
  "title": "Боевая карта замен ГОСТ Р 52290-2004 → ГОСТ Р 52290-2024",
  "normRef": { "doc": "ГОСТ Р 52290-2024", "clause": "таблица различий (первоисточник)" },
  "verification": "Unverified",
  "markers": ["GOST-018"],
  "banner": "Карта замен не сверена с текстом ГОСТ — результат не для выпуска",
  "note": "СПЕЦИАЛЬНО ПУСТО. Карту заполняет СТУДЕНТ по таблице различий из первоисточника. Агент не имеет официального текста ГОСТ и не выдумывает замены. В тестах и демо используется синтетическая карта с пометкой ДЕМО.",
  "isDemo": false,
  "rules": []
}
